{
 "schema": "job_manifest/1",
 "job_id": "job-001",
 "episode_slug": "napoleon",
 "created": "2026-10-29T18:00:00",
 "fps": 24,
 "state": "CREATED",
 "state_since": "2026-10-29T18:00:00",
 "history": [
  {
   "from": null,
   "to": "CREATED",
   "at": "2026-10-29T18:00:00",
   "path": "forward",
   "reason": "created",
   "approval": null
  }
 ],
 "source_dossier_sha256": null,
 "ledger": "run.json",
 "budget_reservation_id": null,
 "approvals": {},
 "artifacts": {},
 "distribution_packages": [],
 "reopen_to": null
}
